{
  "grant_id": "grant_33333333333333333333333333333333",
  "subject_id": "owner:local",
  "plugin_system_id": "plugin_44444444444444444444444444444444",
  "capability": "example.echo",
  "scope": {"capabilities": ["example.echo"]},
  "status": "active",
  "expires_at": null,
  "created_at": "2026-10-01T00:00:00Z"
}
